{
  "id": "rcp_basic_repair",
  "name_zh": "简单修缮",
  "output_item_id": "itm_crowbar",
  "inputs": [
    {"item_id": "itm_cloth_rag", "qty": 1}
  ],
  "tools": [],
  "facility_required": "fac_workbench_basic",
  "skill_required": {
    "skill": "craft",
    "min_level": 1
  },
  "time_minutes": 12,
  "category": "craft"
}