{
  "id": "rcp_meal_field",
  "name_zh": "行军口粮",
  "output_item_id": "itm_dry_rations",
  "inputs": [
    {"item_id": "itm_canned_food", "qty": 2},
    {"item_id": "itm_cloth_rag", "qty": 1}
  ],
  "tools": [],
  "facility_required": "fac_kitchen_basic",
  "skill_required": {
    "skill": "craft",
    "min_level": 1
  },
  "time_minutes": 12,
  "category": "consume"
}