{
  "id": "rcp_bandolier",
  "name_zh": "弹药带制作",
  "output_item_id": "itm_9mm_ammo",
  "inputs": [
    {"item_id": "itm_cloth_rag", "qty": 2},
    {"item_id": "itm_dry_rations", "qty": 1}
  ],
  "tools": ["itm_hammer"],
  "facility_required": "fac_workbench_basic",
  "skill_required": {
    "skill": "craft",
    "min_level": 1
  },
  "time_minutes": 20,
  "category": "craft"
}