{
  "id": "rcp_rope_make",
  "name_zh": "绳索制作",
  "output_item_id": "itm_rope",
  "inputs": [
    {"item_id": "itm_cloth_rag", "qty": 3},
    {"item_id": "itm_dry_rations", "qty": 1}
  ],
  "tools": [],
  "facility_required": "fac_storage_basic",
  "skill_required": {
    "skill": "craft",
    "min_level": 1
  },
  "time_minutes": 10,
  "category": "craft"
}