{
  "id": "rcp_goggles_make",
  "name_zh": "护目镜制作",
  "output_item_id": "itm_goggles",
  "inputs": [
    {"item_id": "itm_cloth_rag", "qty": 1},
    {"item_id": "itm_tape", "qty": 1}
  ],
  "tools": [],
  "facility_required": "fac_workbench_basic",
  "skill_required": {
    "skill": "craft",
    "min_level": 1
  },
  "time_minutes": 14,
  "category": "protect"
}