{
  "id": "rcp_purify_water",
  "name_zh": "净化水",
  "output_item_id": "itm_water_bottle",
  "inputs": [
    {"item_id": "itm_cloth_rag", "qty": 1}
  ],
  "tools": [],
  "facility_required": "fac_kitchen_basic",
  "skill_required": {
    "skill": "craft",
    "min_level": 1
  },
  "time_minutes": 6,
  "category": "consume"
}